{
  "format": "datapass.toolkit",
  "version": "1",
  "title": "Example Org toolkit",
  "updated": "2026-09-26",
  "tools": [
    {
      "id": "ext.fabric-studio",
      "verified": {
        "on": "2026-09-26",
        "version": "2.25.2"
      },
      "maintainer": "Gerhard Brueckl",
      "links": {
        "repo": "https://github.com/gbrueckl/FabricStudio",
        "marketplace": "https://marketplace.visualstudio.com/items?itemName=GerhardBrueckl.fabricstudio"
      },
      "install": [
        {
          "method": "marketplace",
          "id": "GerhardBrueckl.fabricstudio"
        },
        {
          "method": "extension-pack",
          "tool": "pack.powerbi-gbrueckl"
        }
      ],
      "modules": [
        "develop",
        "pipelines",
        "cicd",
        "admin"
      ],
      "complements": [
        "ext.fabric",
        "ext.fabric-data-engineering",
        "cli.fab"
      ],
      "sideEffects": [
        "reads-remote",
        "writes-remote",
        "credential-prompt"
      ],
      "useWhen": "Edit an item definition without Git, run REST calls, manage deployment pipelines from VS Code.",
      "avoidWhen": "The workspace is connected to Git: edit the files in the repository instead."
    },
    {
      "id": "acc.fabric-toolbox",
      "label": "Fabric Toolbox (Fabric CAT)",
      "kind": "accelerator",
      "publisher": "microsoft",
      "status": "active",
      "verified": {
        "on": "2026-09-26"
      },
      "links": {
        "repo": "https://github.com/microsoft/fabric-toolbox"
      },
      "modules": [
        "monitoring",
        "cicd",
        "governance"
      ],
      "sideEffects": [
        "reads-remote",
        "writes-remote"
      ],
      "useWhen": "Monitoring and cost (FUAM, FCA), CI/CD accelerators, Semantic Model Audit, once a real tenant or capacity exists.",
      "avoidWhen": "No Fabric administrator rights or no capacity yet.",
      "priceModel": "included",
      "freeTier": "The repository's content is free to use; it runs on a Fabric capacity, billed separately.",
      "pricingUrl": "https://azure.microsoft.com/pricing/details/microsoft-fabric/",
      "checkedAt": "2026-09-26"
    },
    {
      "id": "learn.fabcon-prodev",
      "label": "FabCon Atlanta Pro Dev workshop",
      "kind": "learning",
      "publisher": "community",
      "verified": {
        "on": "2026-09-26"
      },
      "links": {
        "repo": "https://github.com/slammini/FabConAtlantaProDev"
      },
      "modules": [
        "develop",
        "cicd"
      ],
      "useWhen": "The first Power BI mini-project: PBIP, TMDL, PBIR, AI and DevOps labs."
    },
    {
      "id": "cli.pbi-tools",
      "label": "pbi-tools",
      "kind": "cli",
      "publisher": "community",
      "status": "superseded",
      "replacedBy": "py.fabric-cicd",
      "verified": {
        "on": "2026-09-26"
      },
      "links": {
        "home": "https://pbi.tools/"
      },
      "modules": [
        "cicd"
      ],
      "avoidWhen": "New projects: PBIP in Power BI Desktop, Git integration and fabric-cicd cover it. Keep it only for a legacy .pbix-only project."
    }
  ],
  "datapassRequests": [
    {
      "title": "Probe the Tabular Editor 3 version",
      "why": "Recipes for semantic model audits need Tabular Editor 3 (paid editions); DataPass cannot tell whether it is installed.",
      "example": "a probe for app.tabular-editor that reads the installed version",
      "module": "governance"
    }
  ]
}
